{
  "id": "3f4e5d6c-7b8a-4c9d-0e1f-2a3b4c5d6e7f",
  "title": "Formation du Faire ensemble - Niveau Initiation",
  "description": "Découvrez les fondamentaux de la méthode du Faire ensemble à travers des ateliers pratiques et collaboratifs. Cette formation s'adresse aux bénévoles souhaitant animer des groupes.",
  "workshop": "FDFP",
  "type": "formation",
  "organizer": "a1b2c3d4-e5f6-4a7b-8c9d-0e1f2a3b4c5d",
  "co_organizers": [],
  "lifecycle_status": "active",
  "classification_status": "benevole_grand_public",
  "audience_number": 20,
  "invoice_number": null,
  "is_remote": false,
  "visio_link": null,
  "mural_link": "https://app.mural.co/t/workshop1234/m/fdfp/5678",
  "location": {
    "venue_name": "Centre Culturel de Lyon",
    "street": "25 rue de la Barre",
    "street2": "Salle A - 2ème étage",
    "city": "Lyon",
    "postal_code": "69002",
    "region": "Auvergne-Rhône-Alpes",
    "country": "FR"
  },
  "start_at": "2025-11-15T09:00:00Z",
  "end_at": "2025-11-15T17:00:00Z",
  "mail_pre_html": "<html><body><h1>Bienvenue à la formation FDFP</h1><p>Nous avons hâte de vous accueillir le 15 novembre...</p></body></html>",
  "mail_post_html": "<html><body><h1>Merci pour votre participation</h1><p>Nous espérons que la formation vous a plu...</p></body></html>",
  "modified_date_flag": false,
  "modified_location_flag": false,
  "tenant_id": "1er-Degré",
  "created_at": "2025-09-01T10:00:00Z",
  "updated_at": "2025-10-05T14:30:00Z"
}
