{
  "id": "8a9b0c1d-2e3f-4a5b-6c7d-8e9f0a1b2c3d",
  "title": "Heure Déclic - Formation Professionnelle Niveau 1",
  "description": "Session de formation professionnelle destinée aux enseignants. Découvrez comment intégrer les méthodes collaboratives dans votre pratique pédagogique quotidienne.",
  "workshop": "HD",
  "type": "formation_pro_1",
  "organizer": "f7e8d9c0-b1a2-4536-9d8e-7f6a5b4c3d2e",
  "co_organizers": [
    "a1b2c3d4-e5f6-4a7b-8c9d-0e1f2a3b4c5d",
    "4d5e6f7a-8b9c-4d0e-1f2a-3b4c5d6e7f8a"
  ],
  "lifecycle_status": "active",
  "classification_status": "externe_profs",
  "audience_number": 15,
  "invoice_number": "INV-2025-HD-1042",
  "is_remote": true,
  "visio_link": "https://meet.google.com/abc-defg-hij",
  "mural_link": "https://app.mural.co/t/workshop5678/m/hd/9012",
  "location": null,
  "start_at": "2025-12-03T14:00:00Z",
  "end_at": "2025-12-03T15:30:00Z",
  "mail_pre_html": "<html><body><h1>Heure Déclic - Formation Pro</h1><p>Voici les informations pour rejoindre la session en ligne...</p></body></html>",
  "mail_post_html": "<html><body><h1>Merci d'avoir participé</h1><p>Retrouvez les supports de formation dans votre espace personnel...</p></body></html>",
  "modified_date_flag": true,
  "modified_location_flag": false,
  "tenant_id": "1er-Degré",
  "created_at": "2025-08-20T11:15:00Z",
  "updated_at": "2025-10-10T09:45:00Z"
}
